{
  "dna_id": "dna-b7dcbded1771",
  "tenant_id": "validation-tokyo-2026",
  "model_refs": [
    "dm-fa6ae2f65ea9"
  ],
  "decision_patterns": [
    {
      "pattern_id": "pat-chosen-opt-pursue-build",
      "description": "Chosen option pattern: opt-pursue-build — Create Tokyo AI startup decision knowledge recording a build-now path versus employment baseline.",
      "frequency": 1,
      "model_refs": [
        "dm-fa6ae2f65ea9"
      ]
    }
  ],
  "preference_signals": [
    {
      "signal_id": "sig-5bcd1317dc19",
      "key": "actor_id",
      "value": "founder",
      "frequency": 1
    },
    {
      "signal_id": "sig-a0e23ecb95c5",
      "key": "budget",
      "value": "limited",
      "frequency": 1
    },
    {
      "signal_id": "sig-3b0e1917129e",
      "key": "founderType",
      "value": "solo technical founder",
      "frequency": 1
    },
    {
      "signal_id": "sig-ab7d25dc6bc6",
      "key": "goal",
      "value": "find billion-dollar potential opportunity",
      "frequency": 1
    },
    {
      "signal_id": "sig-aba16e38888f",
      "key": "location",
      "value": "Tokyo Japan",
      "frequency": 1
    },
    {
      "signal_id": "sig-3b0d4f40d153",
      "key": "timeframe",
      "value": "2026",
      "frequency": 1
    }
  ],
  "constraint_patterns": [
    {
      "pattern_id": "cpat-budget",
      "constraint_key": "budget",
      "observed_values": [
        "limited"
      ],
      "frequency": 1
    },
    {
      "pattern_id": "cpat-founderType",
      "constraint_key": "founderType",
      "observed_values": [
        "solo technical founder"
      ],
      "frequency": 1
    },
    {
      "pattern_id": "cpat-goal",
      "constraint_key": "goal",
      "observed_values": [
        "find billion-dollar potential opportunity"
      ],
      "frequency": 1
    },
    {
      "pattern_id": "cpat-location",
      "constraint_key": "location",
      "observed_values": [
        "Tokyo Japan"
      ],
      "frequency": 1
    },
    {
      "pattern_id": "cpat-timeframe",
      "constraint_key": "timeframe",
      "observed_values": [
        "2026"
      ],
      "frequency": 1
    }
  ],
  "risk_profile": {
    "profile_id": "risk-cb1ca7189008",
    "signals": [
      "capital_constrained",
      "solo_founder_capacity",
      "time_bounded:2026"
    ],
    "summary": "Descriptive risk profile from recorded Decision Model constraints and approval path. Not a prediction."
  },
  "created_at": "2026-07-27T11:37:46.798Z",
  "version": "0.1.0",
  "decision_domains": [
    "startup-opportunity:tokyo-japan"
  ],
  "lineage_refs": [
    {
      "model_id": "dm-fa6ae2f65ea9",
      "knowledge_ref": "kn-56b36b0c95105b942d37797381e93794@1.0.0",
      "approval_ref": "ha-c0e6b4d0ea4d",
      "graph_update_ref": "gu-56b36b0c95105b942d37797381e93794@1.0.0"
    }
  ]
}
